{
  "$schema": "https://json-schema.org/draft/2020-12/schema",
  "schema": "AgentRoleProfileRegistry/v1",
  "registry_id": "codex-default-agent-routing",
  "version": 1,
  "capability_epoch": "host-default",
  "role_profiles": [
    {
      "role": "researcher",
      "profile_id": "luna-research-high",
      "enabled": true,
      "model": "gpt-5.6-luna",
      "reasoning": "high",
      "assurance_stage": 1,
      "blind": false,
      "required_independence": false,
      "preferred_mode": "specialist",
      "reuse_if_same_scope": true,
      "context_mode": "task_contract",
      "context_budget": {"max_input_tokens": 12000, "max_output_tokens": 3000, "max_evidence_lines": 80},
      "output_schema": "ResearchResult/v1",
      "ponytail_role": null
    },
    {
      "role": "web-researcher",
      "profile_id": "luna-web-research-high",
      "enabled": true,
      "model": "gpt-5.6-luna",
      "reasoning": "high",
      "assurance_stage": 1,
      "blind": false,
      "required_independence": false,
      "preferred_mode": "specialist",
      "reuse_if_same_scope": true,
      "context_mode": "task_contract",
      "context_budget": {"max_input_tokens": 10000, "max_output_tokens": 2500, "max_evidence_lines": 60},
      "output_schema": "ResearchResult/v1",
      "ponytail_role": null
    },
    {
      "role": "codebase-mapper",
      "profile_id": "luna-code-map-high",
      "enabled": true,
      "model": "gpt-5.6-luna",
      "reasoning": "high",
      "assurance_stage": 1,
      "blind": false,
      "required_independence": false,
      "preferred_mode": "specialist",
      "reuse_if_same_scope": true,
      "context_mode": "task_contract",
      "context_budget": {"max_input_tokens": 14000, "max_output_tokens": 3500, "max_evidence_lines": 100},
      "output_schema": "CodebaseMap/v1",
      "ponytail_role": "codebase-mapping"
    },
    {
      "role": "implementation-planner",
      "profile_id": "luna-plan-high",
      "enabled": true,
      "model": "gpt-5.6-luna",
      "reasoning": "high",
      "assurance_stage": 2,
      "blind": false,
      "required_independence": false,
      "preferred_mode": "reuse",
      "reuse_if_same_scope": true,
      "context_mode": "parent_summary",
      "context_budget": {"max_input_tokens": 16000, "max_output_tokens": 4000, "max_evidence_lines": 100},
      "output_schema": "PlanCheckInput/v1",
      "ponytail_role": "implementation-planner"
    },
    {
      "role": "executor",
      "profile_id": "luna-executor-high",
      "enabled": true,
      "model": "gpt-5.6-luna",
      "reasoning": "high",
      "assurance_stage": 2,
      "blind": false,
      "required_independence": false,
      "preferred_mode": "reuse",
      "reuse_if_same_scope": true,
      "context_mode": "parent_summary",
      "context_budget": {"max_input_tokens": 24000, "max_output_tokens": 6000, "max_evidence_lines": 160},
      "output_schema": "ImplementationResult/v1",
      "ponytail_role": "executor"
    },
    {
      "role": "debugger",
      "profile_id": "luna-debugger-high",
      "enabled": true,
      "model": "gpt-5.6-luna",
      "reasoning": "high",
      "assurance_stage": 2,
      "blind": false,
      "required_independence": false,
      "preferred_mode": "reuse",
      "reuse_if_same_scope": true,
      "context_mode": "parent_summary",
      "context_budget": {"max_input_tokens": 18000, "max_output_tokens": 5000, "max_evidence_lines": 120},
      "output_schema": "DebugResult/v1",
      "ponytail_role": "debugger"
    },
    {
      "role": "plan-checker",
      "profile_id": "luna-plan-check-xhigh",
      "enabled": true,
      "model": "gpt-5.6-luna",
      "reasoning": "xhigh",
      "assurance_stage": 3,
      "blind": true,
      "required_independence": true,
      "preferred_mode": "independent",
      "reuse_if_same_scope": false,
      "context_mode": "task_contract",
      "context_budget": {"max_input_tokens": 12000, "max_output_tokens": 3000, "max_evidence_lines": 80},
      "output_schema": "PlanReview/v1",
      "ponytail_role": null
    },
    {
      "role": "correctness-reviewer",
      "profile_id": "luna-correctness-xhigh",
      "enabled": true,
      "model": "gpt-5.6-luna",
      "reasoning": "xhigh",
      "assurance_stage": 3,
      "blind": true,
      "required_independence": true,
      "preferred_mode": "independent",
      "reuse_if_same_scope": false,
      "context_mode": "sealed_packet",
      "context_budget": {"max_input_tokens": 12000, "max_output_tokens": 3500, "max_evidence_lines": 100},
      "output_schema": "ReviewReceipt/v2",
      "ponytail_role": null
    },
    {
      "role": "security-reviewer",
      "profile_id": "luna-security-xhigh",
      "enabled": true,
      "model": "gpt-5.6-luna",
      "reasoning": "xhigh",
      "assurance_stage": 3,
      "blind": true,
      "required_independence": true,
      "preferred_mode": "independent",
      "reuse_if_same_scope": false,
      "context_mode": "sealed_packet",
      "context_budget": {"max_input_tokens": 14000, "max_output_tokens": 4000, "max_evidence_lines": 120},
      "output_schema": "ReviewReceipt/v2",
      "ponytail_role": null
    },
    {
      "role": "documentation-validator",
      "profile_id": "luna-documentation-xhigh",
      "enabled": true,
      "model": "gpt-5.6-luna",
      "reasoning": "xhigh",
      "assurance_stage": 3,
      "blind": true,
      "required_independence": true,
      "preferred_mode": "independent",
      "reuse_if_same_scope": false,
      "context_mode": "sealed_packet",
      "context_budget": {"max_input_tokens": 10000, "max_output_tokens": 2500, "max_evidence_lines": 80},
      "output_schema": "DocumentationSkillValidation/v1",
      "ponytail_role": null
    },
    {
      "role": "blind-architect",
      "profile_id": "sol-architect-high",
      "enabled": true,
      "model": "gpt-5.6-sol",
      "reasoning": "high",
      "assurance_stage": 4,
      "blind": true,
      "required_independence": true,
      "preferred_mode": "independent",
      "reuse_if_same_scope": false,
      "context_mode": "sealed_packet",
      "context_budget": {"max_input_tokens": 10000, "max_output_tokens": 3000, "max_evidence_lines": 80},
      "output_schema": "ArchitectureDiagnosis/v1",
      "ponytail_role": null
    },
    {
      "role": "synthesizer",
      "profile_id": "luna-synthesizer-max",
      "enabled": true,
      "model": "gpt-5.6-luna",
      "reasoning": "max",
      "assurance_stage": 3,
      "blind": false,
      "required_independence": false,
      "preferred_mode": "reuse",
      "reuse_if_same_scope": true,
      "context_mode": "task_contract",
      "context_budget": {"max_input_tokens": 16000, "max_output_tokens": 4000, "max_evidence_lines": 100},
      "output_schema": "ResearchSynthesis/v1",
      "ponytail_role": null
    }
  ]
}
